{
  "id": "tok_example123456",
  "merchant_id": "mer_example123456",
  "wallet_id": "default",
  "status": "active",
  "origin": {
    "name": "Taro Yamada",
    "email": "taro@example.com",
    "phone": "090-1234-5678",
    "address": {
      "line1": "Shibuya 1-1",
      "city": "Tokyo",
      "state": "Tokyo",
      "zip": "150-0001"
    }
  },
  "description": "Monthly plan token",
  "kind": "recurring",
  "metadata": {},
  "consumer_id": "con_example123456",
  "suspensions": [],
  "test": false,
  "version_nr": 1,
  "created_at": "2026-06-13T00:00:00Z",
  "updated_at": "2026-06-13T00:00:00Z",
  "activated_at": "2026-06-13T00:00:00Z",
  "deleted_at": null
}
